{"schema_version":"1.0","activation_receipt_id":"LS-FLAG-RECEIPT-FIXTURE-001","deployment_id":"LS-DEPLOYMENT-FIXTURE-DELTA-ON","environment":"STAGING","feature_flag":"listing_suite.source_evidence_delta","action":"ENABLE","from_state":"OFF","to_state":"ON","result":"ACTIVATED","actor_id":"DEPLOYER-FIXTURE","approved_by":"PRODUCT-OWNER-FIXTURE","deployment_manifest_ref":"LS-DEPLOYMENT-FIXTURE-DELTA-ON","deployment_manifest_sha256":"dddddddddddddddddddddddddddddddddddddddddddddddddddddddddddddddd","test_receipt_refs":["TEST-RECEIPT-DELTA-001"],"executed_at":"2026-10-04T13:11:00Z","publication_authority":"NOT_GRANTED"}
